{
  "all_passed": false,
  "any_failed": true,
  "cases": {
    "STRATA-001": {
      "blocked_by": null,
      "case_id": "STRATA-001",
      "commands": [
        {
          "argv": [
            "git",
            "rev-parse",
            "HEAD"
          ],
          "cwd": "/Users/cdjk/Downloads/ranklock-v0.25.2-claude-handoff/work/strata-fdb2",
          "duration_ms": 11,
          "env_digest": "e0bf4a45458a20d343fd3d432b7af5c92cd532a6ba6d9d580492534ffabcba83",
          "exit_code": 0,
          "finished_at_utc": "2026-08-16T07:10:59.940475Z",
          "schema": "ranklock-v0252-command-record-v1",
          "started_at_utc": "2026-08-16T07:10:59.929089Z",
          "stderr_path": "/Users/cdjk/Downloads/ranklock-v0.25.2-claude-handoff/work/ranklock-v0.25.1/results/v0252_logs/strata-head.20260816T071059928017Z.stderr.log",
          "stderr_sha256": "e3b0c44298fc1c149afbf4c8996fb92427ae41e4649b934ca495991b7852b855",
          "stdout_path": "/Users/cdjk/Downloads/ranklock-v0.25.2-claude-handoff/work/ranklock-v0.25.1/results/v0252_logs/strata-head.20260816T071059928017Z.stdout.log",
          "stdout_sha256": "0cf6b93986b3e13ff8e9b4ccbb5c99202ddff8aae23a9f2507821c9e5e488346",
          "timed_out": false
        }
      ],
      "description": "checkout is exactly the pinned base commit",
      "evidence": {
        "checkout_path": "/Users/cdjk/Downloads/ranklock-v0.25.2-claude-handoff/work/strata-fdb2",
        "clean_before_patch": true,
        "expected_commit": "f94c06d08ff29eee746f3e20bd63078d2949b304",
        "observed_commit": "f94c06d08ff29eee746f3e20bd63078d2949b304"
      },
      "schema": "ranklock-v0252-case-result-v1",
      "status": "passed"
    },
    "STRATA-002": {
      "blocked_by": null,
      "case_id": "STRATA-002",
      "commands": [
        {
          "argv": [
            "/Users/cdjk/Downloads/ranklock-v0.25.2-claude-handoff/work/ranklock-v0.25.1/.venv/bin/python",
            "/Users/cdjk/Downloads/ranklock-v0.25.2-claude-handoff/work/ranklock-v0.25.1/integration/alpen-validity-first-f94c-v025/apply_validity_first.py",
            "/Users/cdjk/Downloads/ranklock-v0.25.2-claude-handoff/work/strata-fdb2",
            "--check"
          ],
          "cwd": "/Users/cdjk/Downloads/ranklock-v0.25.2-claude-handoff/work/ranklock-v0.25.1",
          "duration_ms": 123,
          "env_digest": "e0bf4a45458a20d343fd3d432b7af5c92cd532a6ba6d9d580492534ffabcba83",
          "exit_code": 0,
          "finished_at_utc": "2026-08-16T07:11:00.103323Z",
          "schema": "ranklock-v0252-command-record-v1",
          "started_at_utc": "2026-08-16T07:10:59.979674Z",
          "stderr_path": "/Users/cdjk/Downloads/ranklock-v0.25.2-claude-handoff/work/ranklock-v0.25.1/results/v0252_logs/strata-preflight.20260816T071059979567Z.stderr.log",
          "stderr_sha256": "e3b0c44298fc1c149afbf4c8996fb92427ae41e4649b934ca495991b7852b855",
          "stdout_path": "/Users/cdjk/Downloads/ranklock-v0.25.2-claude-handoff/work/ranklock-v0.25.1/results/v0252_logs/strata-preflight.20260816T071059979567Z.stdout.log",
          "stdout_sha256": "0a9df470faeaf738c8bc3daf680c1b6bf8574e6aa3d3ec18d6d830d834d2c8a5",
          "timed_out": false
        }
      ],
      "description": "apply_validity_first.py --check passes at the pinned commit",
      "evidence": {
        "exit_code": 0
      },
      "schema": "ranklock-v0252-case-result-v1",
      "status": "passed"
    },
    "STRATA-003": {
      "blocked_by": null,
      "case_id": "STRATA-003",
      "commands": [
        {
          "argv": [
            "git",
            "status",
            "--porcelain"
          ],
          "cwd": "/Users/cdjk/Downloads/ranklock-v0.25.2-claude-handoff/work/strata-fdb2",
          "duration_ms": 23,
          "env_digest": "e0bf4a45458a20d343fd3d432b7af5c92cd532a6ba6d9d580492534ffabcba83",
          "exit_code": 0,
          "finished_at_utc": "2026-08-16T07:11:00.795148Z",
          "schema": "ranklock-v0252-command-record-v1",
          "started_at_utc": "2026-08-16T07:11:00.772104Z",
          "stderr_path": "/Users/cdjk/Downloads/ranklock-v0.25.2-claude-handoff/work/ranklock-v0.25.1/results/v0252_logs/strata-scope.20260816T071100771964Z.stderr.log",
          "stderr_sha256": "e3b0c44298fc1c149afbf4c8996fb92427ae41e4649b934ca495991b7852b855",
          "stdout_path": "/Users/cdjk/Downloads/ranklock-v0.25.2-claude-handoff/work/ranklock-v0.25.1/results/v0252_logs/strata-scope.20260816T071100771964Z.stdout.log",
          "stdout_sha256": "2601fded7a3ab98c8e6bed8c944b6e75a836d7180a428da9dbb67c97227c644e",
          "timed_out": false
        }
      ],
      "description": "patch changes exactly the declared 28-file scope",
      "evidence": {
        "expected_modified": 28,
        "expected_new": 4,
        "git_diff_check_clean": true,
        "modified_files": 28,
        "new_files": 4,
        "paths": [
          "crates/bridge-exec/src/errors.rs",
          "crates/bridge-exec/src/graph/common.rs",
          "crates/bridge-exec/src/graph/mod.rs",
          "crates/bridge-exec/src/graph/ranklock.rs",
          "crates/bridge-sm/src/graph/duties.rs",
          "crates/bridge-sm/src/graph/handlers/retry.rs",
          "crates/bridge-sm/src/graph/machine.rs",
          "crates/bridge-sm/src/graph/tests/contested/process_bridge_proof.rs",
          "crates/bridge-sm/src/graph/tests/contested/process_counterproof.rs",
          "crates/bridge-sm/src/graph/tests/contested/process_counterproof_nackd.rs",
          "crates/bridge-sm/src/graph/tests/handlers/process_retry_tick.rs",
          "crates/bridge-sm/src/graph/tests/mod.rs",
          "crates/bridge-sm/src/graph/tests/notify_new_block.rs",
          "crates/bridge-sm/src/graph/tests/tx_classifier.rs",
          "crates/bridge-sm/src/graph/transitions/common.rs",
          "crates/bridge-sm/src/graph/transitions/contested.rs",
          "crates/bridge-sm/src/graph/transitions/counterproof.rs",
          "crates/bridge-sm/src/graph/tx_classifier.rs",
          "crates/bridge-sm/src/tx_classifier.rs",
          "crates/common/src/logging.rs",
          "crates/connectors/src/lib.rs",
          "crates/connectors/src/prelude.rs",
          "crates/connectors/src/validity_first_counterproof.rs",
          "crates/tx-graph/src/fee.rs",
          "crates/tx-graph/src/game_graph.rs",
          "crates/tx-graph/src/musig_functor.rs",
          "crates/tx-graph/src/transactions/counterproof.rs",
          "crates/tx-graph/src/transactions/counterproof_ack.rs",
          "crates/tx-graph/src/transactions/counterproof_nack.rs",
          "crates/tx-graph/src/transactions/mod.rs",
          "crates/tx-graph/src/transactions/prelude.rs",
          "scripts/ranklock_sidecar_fixture.py"
        ]
      },
      "schema": "ranklock-v0252-case-result-v1",
      "status": "passed"
    },
    "STRATA-004": {
      "blocked_by": null,
      "case_id": "STRATA-004",
      "commands": [
        {
          "argv": [
            "cargo",
            "fmt",
            "--all",
            "--",
            "--check"
          ],
          "cwd": "/Users/cdjk/Downloads/ranklock-v0.25.2-claude-handoff/work/strata-fdb2",
          "duration_ms": 508,
          "env_digest": "e0bf4a45458a20d343fd3d432b7af5c92cd532a6ba6d9d580492534ffabcba83",
          "exit_code": 0,
          "finished_at_utc": "2026-08-16T07:11:01.325506Z",
          "schema": "ranklock-v0252-command-record-v1",
          "started_at_utc": "2026-08-16T07:11:00.816823Z",
          "stderr_path": "/Users/cdjk/Downloads/ranklock-v0.25.2-claude-handoff/work/ranklock-v0.25.1/results/v0252_logs/strata-fmt.20260816T071100816733Z.stderr.log",
          "stderr_sha256": "e3b0c44298fc1c149afbf4c8996fb92427ae41e4649b934ca495991b7852b855",
          "stdout_path": "/Users/cdjk/Downloads/ranklock-v0.25.2-claude-handoff/work/ranklock-v0.25.1/results/v0252_logs/strata-fmt.20260816T071100816733Z.stdout.log",
          "stdout_sha256": "e3b0c44298fc1c149afbf4c8996fb92427ae41e4649b934ca495991b7852b855",
          "timed_out": false
        }
      ],
      "description": "cargo fmt --all -- --check passes on the patched tree",
      "evidence": {
        "exit_code": 0
      },
      "schema": "ranklock-v0252-case-result-v1",
      "status": "passed"
    },
    "STRATA-005": {
      "blocked_by": null,
      "case_id": "STRATA-005",
      "commands": [
        {
          "argv": [
            "cargo",
            "check",
            "--workspace",
            "--all-targets",
            "--locked",
            "--offline"
          ],
          "cwd": "/Users/cdjk/Downloads/ranklock-v0.25.2-claude-handoff/work/strata-fdb2",
          "duration_ms": 104322,
          "env_digest": "e0bf4a45458a20d343fd3d432b7af5c92cd532a6ba6d9d580492534ffabcba83",
          "exit_code": 0,
          "finished_at_utc": "2026-08-16T07:12:45.649115Z",
          "schema": "ranklock-v0252-command-record-v1",
          "started_at_utc": "2026-08-16T07:11:01.326028Z",
          "stderr_path": "/Users/cdjk/Downloads/ranklock-v0.25.2-claude-handoff/work/ranklock-v0.25.1/results/v0252_logs/strata-strata-005.20260816T071101325963Z.stderr.log",
          "stderr_sha256": "541df18a7af9da1984d2724323591fb2abfa967b113c6eaf735f37e7fd2df975",
          "stdout_path": "/Users/cdjk/Downloads/ranklock-v0.25.2-claude-handoff/work/ranklock-v0.25.1/results/v0252_logs/strata-strata-005.20260816T071101325963Z.stdout.log",
          "stdout_sha256": "e3b0c44298fc1c149afbf4c8996fb92427ae41e4649b934ca495991b7852b855",
          "timed_out": false
        }
      ],
      "description": "cargo check --workspace --all-targets passes",
      "evidence": {
        "argv": [
          "cargo",
          "check",
          "--workspace",
          "--all-targets",
          "--locked",
          "--offline"
        ],
        "exit_code": 0
      },
      "schema": "ranklock-v0252-case-result-v1",
      "status": "passed"
    },
    "STRATA-006": {
      "blocked_by": null,